{
  "$schema": "https://json-schema.org/draft/2020-12/schema",
  "$id": "https://agenteval.dev/aef/v2/reader/checkpoint.schema.json",
  "title": "AEF v2: checkpoint manifest",
  "description": "READER (tolerant), derived from the writer schema by tools/derive_reader.py. A release decision over several evidence lanes for one exact subject version: the lanes and their rules, the exact sealed runs each lane used (with their run hashes), the decision function's input and output once decided, and the state. See v2/README.md, 'Checkpoints'.",
  "type": "object",
  "required": [
    "schemaVersion",
    "checkpointId",
    "subject",
    "lanes",
    "state"
  ],
  "properties": {
    "schemaVersion": {
      "$ref": "common.schema.json#/$defs/schemaVersion"
    },
    "checkpointId": {
      "$ref": "common.schema.json#/$defs/id"
    },
    "template": {
      "type": "object",
      "required": [
        "ref",
        "version"
      ],
      "properties": {
        "ref": {
          "$ref": "common.schema.json#/$defs/ref"
        },
        "version": {
          "type": "string",
          "minLength": 1,
          "maxLength": 64
        }
      }
    },
    "subject": {
      "description": "The exact version decided on. 'latest' is resolved before anything runs, and recorded: resolvedFrom says what was asked, version what it resolved to.",
      "type": "object",
      "required": [
        "ref",
        "version"
      ],
      "properties": {
        "ref": {
          "$ref": "common.schema.json#/$defs/ref"
        },
        "version": {
          "$ref": "common.schema.json#/$defs/exactVersion"
        },
        "image": {
          "$ref": "common.schema.json#/$defs/sha256Uri"
        },
        "deployment": {
          "$ref": "common.schema.json#/$defs/ref"
        },
        "resolvedFrom": {
          "type": "string",
          "maxLength": 256
        },
        "resolvedAt": {
          "$ref": "common.schema.json#/$defs/timestamp"
        }
      }
    },
    "lanes": {
      "type": "array",
      "minItems": 1,
      "maxItems": 64,
      "items": {
        "type": "object",
        "required": [
          "lane",
          "rule",
          "runs",
          "blocking"
        ],
        "properties": {
          "lane": {
            "$ref": "common.schema.json#/$defs/laneName"
          },
          "rule": {
            "$ref": "#/$defs/laneRule"
          },
          "requirements": {
            "type": "array",
            "maxItems": 256,
            "items": {
              "$ref": "common.schema.json#/$defs/id"
            }
          },
          "runs": {
            "description": "The exact sealed runs this lane used; empty while pending.",
            "type": "array",
            "maxItems": 1024,
            "items": {
              "$ref": "common.schema.json#/$defs/runRef"
            }
          },
          "blocking": {
            "description": "A failed blocking lane blocks the release; a failed advisory lane is reported, never ignored.",
            "type": "boolean"
          },
          "freshness": {
            "description": "The shortest freshness among the lane's requirements, resolved when the checkpoint was planned.",
            "$ref": "common.schema.json#/$defs/duration"
          }
        }
      }
    },
    "comparability": {
      "type": "object",
      "required": [
        "required"
      ],
      "properties": {
        "required": {
          "description": "The axes on which a comparison lane's runs must match their baseline (judge.modelId, judge.rubricDigest, stimulus, executionPolicy, ...).",
          "type": "array",
          "maxItems": 32,
          "items": {
            "type": "string",
            "maxLength": 64
          }
        }
      }
    },
    "budget": {
      "type": "object",
      "properties": {
        "approvedUsd": {
          "type": "number",
          "minimum": 0
        },
        "spentUsd": {
          "type": "number",
          "minimum": 0
        },
        "approvedBy": {
          "$ref": "common.schema.json#/$defs/trustedIdentity"
        }
      }
    },
    "state": {
      "type": "string"
    },
    "outcome": {
      "description": "Set from state decided on; null before. aborted when the checkpoint was abandoned (abortReason says why), never from the decision function.",
      "anyOf": [
        {
          "type": "null"
        },
        {
          "type": "string"
        }
      ]
    },
    "decision": {
      "description": "The decision function's output, recorded when the state became decided.",
      "$ref": "decision.schema.json"
    },
    "ext": {
      "$ref": "common.schema.json#/$defs/ext"
    },
    "abortReason": {
      "type": "string",
      "minLength": 1,
      "maxLength": 2048
    },
    "decisionInput": {
      "description": "The decision function's input, recorded with its output so anyone can recompute it.",
      "$ref": "decision.schema.json#/$defs/input"
    }
  },
  "allOf": [
    {
      "description": "Decided by the decision function: its input and output are recorded.",
      "if": {
        "properties": {
          "state": {
            "enum": [
              "decided",
              "sealed"
            ]
          },
          "outcome": {
            "enum": [
              "approved",
              "blocked",
              "inconclusive",
              "expired"
            ]
          }
        },
        "required": [
          "state",
          "outcome"
        ]
      },
      "then": {
        "required": [
          "decision",
          "decisionInput"
        ]
      }
    },
    {
      "description": "Abandoned: it says why, and records no decision.",
      "if": {
        "properties": {
          "outcome": {
            "const": "aborted"
          }
        },
        "required": [
          "outcome"
        ]
      },
      "then": {
        "required": [
          "abortReason"
        ],
        "not": {
          "anyOf": [
            {
              "required": [
                "decision"
              ]
            },
            {
              "required": [
                "decisionInput"
              ]
            }
          ]
        }
      }
    },
    {
      "description": "From decided on, there is an outcome.",
      "if": {
        "properties": {
          "state": {
            "enum": [
              "decided",
              "sealed"
            ]
          }
        },
        "required": [
          "state"
        ]
      },
      "then": {
        "required": [
          "outcome"
        ],
        "properties": {
          "outcome": {
            "not": {
              "type": "null"
            }
          }
        }
      }
    },
    {
      "description": "Before the decision, there is none.",
      "if": {
        "properties": {
          "state": {
            "enum": [
              "draft",
              "planned",
              "approved_to_spend",
              "running",
              "evidence_complete"
            ]
          }
        },
        "required": [
          "state"
        ]
      },
      "then": {
        "properties": {
          "outcome": {
            "type": "null"
          }
        },
        "not": {
          "anyOf": [
            {
              "required": [
                "decision"
              ]
            },
            {
              "required": [
                "decisionInput"
              ]
            }
          ]
        }
      }
    }
  ],
  "$defs": {
    "laneRule": {
      "description": "What kind of rule a lane applies. A family with no published pass threshold takes comparison or evidence-present, never threshold.",
      "anyOf": [
        {
          "type": "object",
          "required": [
            "kind",
            "metric",
            "op",
            "value"
          ],
          "properties": {
            "kind": {
              "const": "threshold"
            },
            "metric": {
              "type": "string",
              "minLength": 1,
              "maxLength": 256
            },
            "op": {
              "type": "string"
            },
            "value": {
              "type": "number"
            }
          }
        },
        {
          "type": "object",
          "required": [
            "kind",
            "max"
          ],
          "properties": {
            "kind": {
              "const": "severity"
            },
            "max": {
              "description": "The worst severity allowed among the lane's required results.",
              "type": "string"
            }
          }
        },
        {
          "type": "object",
          "required": [
            "kind",
            "baseline",
            "significance"
          ],
          "properties": {
            "kind": {
              "const": "comparison"
            },
            "baseline": {
              "type": "string",
              "minLength": 1,
              "maxLength": 256
            },
            "significance": {
              "type": "number",
              "exclusiveMinimum": 0,
              "exclusiveMaximum": 1
            }
          }
        },
        {
          "type": "object",
          "required": [
            "kind",
            "groups"
          ],
          "properties": {
            "kind": {
              "const": "evidence-present"
            },
            "groups": {
              "type": "integer",
              "minimum": 1
            }
          }
        },
        {
          "type": "object",
          "required": [
            "kind"
          ],
          "properties": {
            "kind": {
              "type": "string",
              "not": {
                "enum": [
                  "threshold",
                  "severity",
                  "comparison",
                  "evidence-present"
                ]
              }
            }
          }
        }
      ]
    }
  }
}
