{
  "schemaVersion": "2.0",
  "checkpointId": "cp_01J9K4",
  "template": {
    "ref": "template:support/release-candidate",
    "version": "3"
  },
  "subject": {
    "ref": "agent:support/support-triage",
    "version": "git:3f2a1c",
    "image": "sha256:9d9d9d9d9d9d9d9d9d9d9d9d9d9d9d9d9d9d9d9d9d9d9d9d9d9d9d9d9d9d9d9d",
    "deployment": "deployment:support/support-triage@prod-eu",
    "resolvedFrom": "latest",
    "resolvedAt": "2026-10-02T13:58:00Z"
  },
  "lanes": [
    {
      "lane": "quality",
      "rule": {
        "kind": "threshold",
        "metric": "triage.passRate",
        "op": ">=",
        "value": 0.8
      },
      "requirements": [
        "REQ-07"
      ],
      "runs": [
        {
          "runId": "Q-184",
          "runHash": "aaaaaaaaaaaaaaaaaaaaaaaaaaaaaaaaaaaaaaaaaaaaaaaaaaaaaaaaaaaaaaaa",
          "origin": "launched"
        }
      ],
      "blocking": true
    },
    {
      "lane": "security",
      "rule": {
        "kind": "severity",
        "max": "low"
      },
      "requirements": [
        "REQ-15"
      ],
      "runs": [
        {
          "runId": "R-921",
          "runHash": "bbbbbbbbbbbbbbbbbbbbbbbbbbbbbbbbbbbbbbbbbbbbbbbbbbbbbbbbbbbbbbbb",
          "origin": "adopted:ci"
        },
        {
          "runId": "R-930",
          "runHash": "cccccccccccccccccccccccccccccccccccccccccccccccccccccccccccccccc",
          "origin": "launched"
        }
      ],
      "blocking": true,
      "freshness": "P14D"
    },
    {
      "lane": "memory",
      "rule": {
        "kind": "comparison",
        "baseline": "policy:same-branch",
        "significance": 0.05
      },
      "runs": [],
      "blocking": false
    }
  ],
  "comparability": {
    "required": [
      "judge.modelId",
      "judge.rubricDigest",
      "stimulus",
      "executionPolicy"
    ]
  },
  "budget": {
    "approvedUsd": 10.0,
    "spentUsd": 6.4,
    "approvedBy": {
      "identity": "git:owner@example.com",
      "assurance": "self-attested"
    }
  },
  "state": "decided",
  "outcome": "inconclusive",
  "decisionInput": {
    "subjectVersion": "git:3f2a1c",
    "evaluatedAt": "2026-10-02T14:30:00Z",
    "supersededBy": null,
    "lanes": [
      {
        "lane": "quality",
        "blocking": true,
        "result": {
          "status": "failed",
          "subjectVersion": "git:3f2a1c",
          "oldestClosedAt": "2026-10-02T13:10:00Z"
        }
      },
      {
        "lane": "security",
        "blocking": true,
        "freshness": "P14D",
        "result": {
          "status": "passed",
          "subjectVersion": "git:3f2a1c",
          "oldestClosedAt": "2026-09-30T08:00:00Z"
        }
      },
      {
        "lane": "memory",
        "blocking": false,
        "result": null
      }
    ]
  },
  "decision": {
    "outcome": "inconclusive",
    "lanes": [
      {
        "lane": "quality",
        "status": "passed",
        "blocking": true
      },
      {
        "lane": "security",
        "status": "passed",
        "blocking": true
      },
      {
        "lane": "memory",
        "status": "missing",
        "blocking": false
      }
    ],
    "reasons": [
      "missing:memory",
      "outcome:inconclusive"
    ]
  }
}
