{
  "schemaVersion": "2.0",
  "checkpointId": "cp_01J9K4",
  "template": {
    "ref": "template:support/release-candidate",
    "version": "3"
  },
  "subject": {
    "ref": "agent:support/support-triage",
    "version": "git:3f2a1c",
    "image": "sha256:9d9d9d9d9d9d9d9d9d9d9d9d9d9d9d9d9d9d9d9d9d9d9d9d9d9d9d9d9d9d9d9d",
    "deployment": "deployment:support/support-triage@prod-eu",
    "resolvedFrom": "latest",
    "resolvedAt": "2026-10-02T13:58:00Z"
  },
  "lanes": [
    {
      "lane": "red team",
      "rule": {
        "kind": "threshold",
        "metric": "triage.passRate",
        "op": ">=",
        "value": 0.8
      },
      "requirements": [
        "REQ-07"
      ],
      "runs": [
        {
          "runId": "Q-184",
          "runHash": "aaaaaaaaaaaaaaaaaaaaaaaaaaaaaaaaaaaaaaaaaaaaaaaaaaaaaaaaaaaaaaaa",
          "origin": "launched"
        }
      ],
      "blocking": true
    }
  ],
  "comparability": {
    "required": [
      "judge.modelId",
      "judge.rubricDigest",
      "stimulus",
      "executionPolicy"
    ]
  },
  "budget": {
    "approvedUsd": 10.0,
    "spentUsd": 6.4,
    "approvedBy": {
      "identity": "git:owner@example.com",
      "assurance": "self-attested"
    }
  },
  "state": "planned",
  "outcome": null
}
